{
  "commitId": "urn:pinecrest:commit:01HZBBBB00000000000000000B",
  "resourceId": "pinecrest/customer-orders-daily",
  "versionId": "1.1.0",
  "action": "update",
  "actor": "pinecrest:owner:customer-orders-team",
  "rationale": "Schema evolution v1.0.0 → v1.1.0 (non-breaking column add: customer_segment). Composition dependencies unchanged (same upstream pinning). Submitted in draft for refresh-SLA validation before activation.",
  "evidenceRefs": [
    "urn:pinecrest:evidence:schema-validation:pinecrest/customer-orders-daily/1.1.0",
    "urn:pinecrest:evidence:upstream-pin-check:pinecrest/customer-orders-daily/1.1.0",
    "urn:pinecrest:evidence:non-breaking-diff:pinecrest/customer-orders-daily/1.0.0-to-1.1.0"
  ],
  "createdAt": "2026-05-06T15:00:07Z"
}
