{
  "commitId": "commit.agent.customer-support.v3",
  "resourceId": "agent.customer-support",
  "versionId": "v3",
  "action": "update",
  "actor": "service://control-plane/registrar",
  "rationale": "Deploy improved triage policy for high-priority tickets",
  "evidenceRefs": [
    "trace://evaluation/run-742",
    "approval://change-review/193"
  ],
  "createdAt": "2026-04-20T09:00:00Z"
}
