{
  "commitId": "urn:pinecrest:commit:01HZAAAA00000000000000000A",
  "resourceId": "pinecrest/customer-orders-daily",
  "versionId": "1.0.0",
  "action": "create",
  "actor": "pinecrest:owner:customer-orders-team",
  "rationale": "Initial publication of v1.0.0 (Customer Orders — Daily) to the Pinecrest catalog. Composed from pinecrest/customer-master@v3 and pinecrest/order-events-stream@v7. Submitted in draft for refresh-SLA validation before activation.",
  "evidenceRefs": [
    "urn:pinecrest:evidence:schema-validation:pinecrest/customer-orders-daily/1.0.0",
    "urn:pinecrest:evidence:upstream-pin-check:pinecrest/customer-orders-daily/1.0.0"
  ],
  "createdAt": "2026-05-06T14:00:07Z"
}
